{
  "$id": "https://herdrops.local/schema/v0.7/human-design-review.schema.json",
  "schemaVersion": 1,
  "contract": {
    "issue": 35,
    "version": "0.7.0",
    "productId": "HerdrOps",
    "immutableReferenceSet": "docs/design/reference/*.png",
    "designContract": "Plan/DESIGN-CONTRACT.md"
  },
  "reviewStatus": "Pending",
  "reviewer": {
    "name": "[PLACEHOLDER]: reviewer display name",
    "role": "[PLACEHOLDER]: reviewer role",
    "organization": "[PLACEHOLDER]: reviewer organization",
    "independent": false,
    "signatureDate": "9999-12-31",
    "signatory": "[PLACEHOLDER]: signed name"
  },
  "provenance": {
    "boundCommitSha256": "0000000000000000000000000000000000000000000000000000000000000000",
    "runHash": "0000000000000000000000000000000000000000000000000000000000000000",
    "artifactHash": "0000000000000000000000000000000000000000000000000000000000000000",
    "hashAlgorithm": "SHA-256",
    "canonicalRunDescriptor": "[PLACEHOLDER]: deterministic run descriptor"
  },
  "uiUnderReview": {
    "surfaceKind": "Observed WPF build",
    "wpfBuild": {
      "assembly": "HerdrOps.App",
      "branch": "[PLACEHOLDER]: branch",
      "commitSha256": "0000000000000000000000000000000000000000000000000000000000000000",
      "configuration": "Release"
    },
    "hostOs": "[PLACEHOLDER]: host OS",
    "hostResolutionWidth": 1672,
    "hostResolutionHeight": 941,
    "dpiScaleFactor": 100,
    "captureTool": {
      "name": "[PLACEHOLDER]: capture tool",
      "runtime": "[PLACEHOLDER]: runtime",
      "version": "[PLACEHOLDER]: tool version"
    },
    "observedWindow": "[PLACEHOLDER]: observed top-level window",
    "captureDate": "9999-12-31T00:00:00Z"
  },
  "captures": [
    {
      "refersToReference": "11-widget-concepts.png",
      "sha256": "0000000000000000000000000000000000000000000000000000000000000000",
      "width": 1672,
      "language": "en",
      "relativePath": "captures/README-placeholder",
      "height": 941,
      "kind": "contact-sheet"
    }
  ],
  "pages": {
    "agent-detail": {
      "accessibility": {
        "keyboardFocusVisible": {
          "passed": false,
          "evidence": {
            "boundSha256": "0000000000000000000000000000000000000000000000000000000000000000",
            "note": "[PLACEHOLDER]: keyboard focus visible evidence"
          }
        },
        "thaiTextNoClipping": {
          "passed": false,
          "evidence": {
            "boundSha256": "0000000000000000000000000000000000000000000000000000000000000000",
            "note": "[PLACEHOLDER]: thai clipping evidence"
          }
        },
        "focusOrderValid": {
          "passed": false,
          "evidence": {
            "boundSha256": "0000000000000000000000000000000000000000000000000000000000000000",
            "note": "[PLACEHOLDER]: focus order evidence"
          }
        },
        "automationNamesPresent": {
          "passed": false,
          "evidence": {
            "boundSha256": "0000000000000000000000000000000000000000000000000000000000000000",
            "note": "[PLACEHOLDER]: automation names evidence"
          }
        },
        "screenReaderSmoke": {
          "passed": false,
          "evidence": {
            "boundSha256": "0000000000000000000000000000000000000000000000000000000000000000",
            "note": "[PLACEHOLDER]: screen reader smoke evidence"
          }
        },
        "reducedMotionSupported": {
          "passed": false,
          "evidence": {
            "boundSha256": "0000000000000000000000000000000000000000000000000000000000000000",
            "note": "[PLACEHOLDER]: reduced motion evidence"
          }
        }
      },
      "languageCoverage": {
        "th": {
          "125": {
            "captureRef": "captures/th/pages/agent-detail-125.png",
            "sha256": "0000000000000000000000000000000000000000000000000000000000000000"
          },
          "150": {
            "captureRef": "captures/th/pages/agent-detail-150.png",
            "sha256": "0000000000000000000000000000000000000000000000000000000000000000"
          },
          "100": {
            "captureRef": "captures/th/pages/agent-detail-100.png",
            "sha256": "0000000000000000000000000000000000000000000000000000000000000000"
          }
        },
        "en": {
          "125": {
            "captureRef": "captures/en/pages/agent-detail-125.png",
            "sha256": "0000000000000000000000000000000000000000000000000000000000000000"
          },
          "150": {
            "captureRef": "captures/en/pages/agent-detail-150.png",
            "sha256": "0000000000000000000000000000000000000000000000000000000000000000"
          },
          "100": {
            "captureRef": "captures/en/pages/agent-detail-100.png",
            "sha256": "0000000000000000000000000000000000000000000000000000000000000000"
          }
        }
      }
    },
    "realtime-activity": {
      "accessibility": {
        "keyboardFocusVisible": {
          "passed": false,
          "evidence": {
            "boundSha256": "0000000000000000000000000000000000000000000000000000000000000000",
            "note": "[PLACEHOLDER]: keyboard focus visible evidence"
          }
        },
        "thaiTextNoClipping": {
          "passed": false,
          "evidence": {
            "boundSha256": "0000000000000000000000000000000000000000000000000000000000000000",
            "note": "[PLACEHOLDER]: thai clipping evidence"
          }
        },
        "focusOrderValid": {
          "passed": false,
          "evidence": {
            "boundSha256": "0000000000000000000000000000000000000000000000000000000000000000",
            "note": "[PLACEHOLDER]: focus order evidence"
          }
        },
        "automationNamesPresent": {
          "passed": false,
          "evidence": {
            "boundSha256": "0000000000000000000000000000000000000000000000000000000000000000",
            "note": "[PLACEHOLDER]: automation names evidence"
          }
        },
        "screenReaderSmoke": {
          "passed": false,
          "evidence": {
            "boundSha256": "0000000000000000000000000000000000000000000000000000000000000000",
            "note": "[PLACEHOLDER]: screen reader smoke evidence"
          }
        },
        "reducedMotionSupported": {
          "passed": false,
          "evidence": {
            "boundSha256": "0000000000000000000000000000000000000000000000000000000000000000",
            "note": "[PLACEHOLDER]: reduced motion evidence"
          }
        }
      },
      "languageCoverage": {
        "th": {
          "125": {
            "captureRef": "captures/th/pages/realtime-activity-125.png",
            "sha256": "0000000000000000000000000000000000000000000000000000000000000000"
          },
          "150": {
            "captureRef": "captures/th/pages/realtime-activity-150.png",
            "sha256": "0000000000000000000000000000000000000000000000000000000000000000"
          },
          "100": {
            "captureRef": "captures/th/pages/realtime-activity-100.png",
            "sha256": "0000000000000000000000000000000000000000000000000000000000000000"
          }
        },
        "en": {
          "125": {
            "captureRef": "captures/en/pages/realtime-activity-125.png",
            "sha256": "0000000000000000000000000000000000000000000000000000000000000000"
          },
          "150": {
            "captureRef": "captures/en/pages/realtime-activity-150.png",
            "sha256": "0000000000000000000000000000000000000000000000000000000000000000"
          },
          "100": {
            "captureRef": "captures/en/pages/realtime-activity-100.png",
            "sha256": "0000000000000000000000000000000000000000000000000000000000000000"
          }
        }
      }
    },
    "compliance-queue": {
      "accessibility": {
        "keyboardFocusVisible": {
          "passed": false,
          "evidence": {
            "boundSha256": "0000000000000000000000000000000000000000000000000000000000000000",
            "note": "[PLACEHOLDER]: keyboard focus visible evidence"
          }
        },
        "thaiTextNoClipping": {
          "passed": false,
          "evidence": {
            "boundSha256": "0000000000000000000000000000000000000000000000000000000000000000",
            "note": "[PLACEHOLDER]: thai clipping evidence"
          }
        },
        "focusOrderValid": {
          "passed": false,
          "evidence": {
            "boundSha256": "0000000000000000000000000000000000000000000000000000000000000000",
            "note": "[PLACEHOLDER]: focus order evidence"
          }
        },
        "automationNamesPresent": {
          "passed": false,
          "evidence": {
            "boundSha256": "0000000000000000000000000000000000000000000000000000000000000000",
            "note": "[PLACEHOLDER]: automation names evidence"
          }
        },
        "screenReaderSmoke": {
          "passed": false,
          "evidence": {
            "boundSha256": "0000000000000000000000000000000000000000000000000000000000000000",
            "note": "[PLACEHOLDER]: screen reader smoke evidence"
          }
        },
        "reducedMotionSupported": {
          "passed": false,
          "evidence": {
            "boundSha256": "0000000000000000000000000000000000000000000000000000000000000000",
            "note": "[PLACEHOLDER]: reduced motion evidence"
          }
        }
      },
      "languageCoverage": {
        "th": {
          "125": {
            "captureRef": "captures/th/pages/compliance-queue-125.png",
            "sha256": "0000000000000000000000000000000000000000000000000000000000000000"
          },
          "150": {
            "captureRef": "captures/th/pages/compliance-queue-150.png",
            "sha256": "0000000000000000000000000000000000000000000000000000000000000000"
          },
          "100": {
            "captureRef": "captures/th/pages/compliance-queue-100.png",